{
  "schema": 1,
  "updatedAt": "2026-10-26",
  "network": "mainnet",
  "relays": [
    {
      "id": "aestus",
      "name": "Aestus",
      "url": "https://0xa15b52576bcbf1072f4a011c0f99f9fb6c66f3e1ff321f11f461d15e31b1cb359caa092c71bbded0bae5b5ea401aab7e@aestus.live",
      "about": "https://aestus.live",
      "filtering": "none",
      "recommended": true,
      "status": "live",
      "statusSince": "2026-10-11",
      "note": ""
    },
    {
      "id": "agnostic",
      "name": "Agnostic Gnosis",
      "url": "https://0xa7ab7a996c8584251c8f925da3170bdfd6ebc75d50f5ddc4050a6fdc77f2a3b5fce2cc750d0865e05d7228af97d69561@agnostic-relay.net",
      "about": "https://agnostic-relay.net/",
      "filtering": "none",
      "recommended": true,
      "status": "live",
      "statusSince": "2026-10-11",
      "note": ""
    },
    {
      "id": "titan",
      "name": "Titan Relay",
      "url": "https://0x8c4ed5e24fe5c6ae21018437bde147693f68cda427cd1122cf20819c30eda7ed74f72dece09bb313f2a1855595ab677d@global.titanrelay.xyz",
      "about": "https://docs.titanrelay.xyz/",
      "filtering": "none",
      "recommended": true,
      "status": "live",
      "statusSince": "2026-10-11",
      "note": ""
    },
    {
      "id": "ultrasound",
      "name": "Ultra Sound",
      "url": "https://0xa1559ace749633b997cb3fdacffb890aeebdb0f5a3b6aaa7eeeaf1a38af0a8fe88b9e4b1f61f236d2e64d95733327a62@relay.ultrasound.money",
      "about": "https://relay.ultrasound.money/",
      "filtering": "none",
      "recommended": true,
      "status": "live",
      "statusSince": "2026-10-11",
      "note": ""
    },
    {
      "id": "wenmerge",
      "name": "Wenmerge",
      "url": "https://0x8c7d33605ecef85403f8b7289c8058f440cbb6bf72b055dfe2f3e2c6695b6a1ea5a9cd0eb3a7982927a463feb4c3dae2@relay.wenmerge.com",
      "about": "https://relay.wenmerge.com",
      "filtering": "none",
      "recommended": false,
      "status": "retired",
      "statusSince": "2026-10-26",
      "note": "Not answering on 2026-10-11; the owner decides whether to recommend it again."
    },
    {
      "id": "flashbots",
      "name": "Flashbots",
      "url": "https://0xac6e77dfe25ecd6110b8e780608cce0dab71fdd5ebea22a16c0205200f2f8e2e3ad3b71d3499c54ad14d6c21b41a37ae@boost-relay.flashbots.net",
      "about": "https://boost.flashbots.net/",
      "filtering": "sanctions",
      "recommended": true,
      "status": "live",
      "statusSince": "2026-10-11",
      "note": ""
    },
    {
      "id": "bloxroute-max-profit",
      "name": "bloXroute Max Profit",
      "url": "https://0x8b5d2e73e2a3a55c6c87b8b6eb92e0149a125c852751db1422fa951e42a09b82c142c3ea98d0d9930b056a3bc9896b8f@bloxroute.max-profit.blxrbdn.com",
      "about": "https://bloxroute.com/",
      "filtering": "sanctions",
      "recommended": false,
      "status": "retired",
      "statusSince": "2026-10-11",
      "note": "No DNS record since at least 2026-10-11; retired by hand. The weekly check revives it if it answers again."
    },
    {
      "id": "bloxroute-regulated",
      "name": "bloXroute Regulated",
      "url": "https://0xb0b07cd0abef743db4260b0ed50619cf6ad4d82064cb4fbec9d3ec530f7c5e6793d9f286c4e082c0244ffb9f2658fe88@bloxroute.regulated.blxrbdn.com",
      "about": "https://bloxroute.com/",
      "filtering": "sanctions",
      "recommended": true,
      "status": "live",
      "statusSince": "2026-10-11",
      "note": ""
    },
    {
      "id": "titan-regional",
      "name": "Titan Relay Regional",
      "url": "https://0x8c4ed5e24fe5c6ae21018437bde147693f68cda427cd1122cf20819c30eda7ed74f72dece09bb313f2a1855595ab677d@regional.titanrelay.xyz",
      "about": "https://docs.titanrelay.xyz/",
      "filtering": "sanctions",
      "recommended": true,
      "status": "live",
      "statusSince": "2026-10-11",
      "note": ""
    },
    {
      "id": "bloxroute-ethical",
      "name": "bloXroute Ethical",
      "url": "https://0xad0a8bb54565c2211cee576363f3a347089d2f07cf72679d16911d740262694cadb62d7fd7483f27afd714ca0f1b9118@bloxroute.ethical.blxrbdn.com",
      "about": "https://bloxroute.com/",
      "filtering": "sanctions",
      "recommended": false,
      "status": "retired",
      "statusSince": "2026-10-11",
      "note": "This relay has shut down."
    },
    {
      "id": "blocknative",
      "name": "Blocknative",
      "url": "https://0x9000009807ed12c1f08bf4e81c6da3ba8e3fc3d953898ce0102433094e5f22f21102ec057841fcb81978ed1ea0fa8246@builder-relay-mainnet.blocknative.com",
      "about": "https://www.blocknative.com/",
      "filtering": "sanctions",
      "recommended": false,
      "status": "retired",
      "statusSince": "2026-10-11",
      "note": "This relay has shut down."
    },
    {
      "id": "manifold",
      "name": "Manifold",
      "url": "https://0x98650451ba02064f7b000f5768cf0cf4d4e492317d82871bdc87ef841a0743f69f0f1eea11168503240ac35d101c9135@mainnet-relay.securerpc.com",
      "about": "https://securerpc.com/",
      "filtering": "none",
      "recommended": false,
      "status": "retired",
      "statusSince": "2026-10-11",
      "note": "This relay has shut down."
    },
    {
      "id": "proof-relay",
      "name": "Proof Relay",
      "url": "https://0xa44f64faca0209764461b2abfe3533f9f6ed1d51844974e22d79d4cfd06eff858bb434d063e512ce55a1841e66977bfd@proof-relay.ponrelay.com",
      "about": "https://pon.network/",
      "filtering": "none",
      "recommended": false,
      "status": "retired",
      "statusSince": "2026-10-11",
      "note": "This relay has shut down."
    }
  ]
}
